signal_name,mean_abs_shap,dim_count,dimensions
Msg Char Len Mean,0.94456315,5,"emb_1, emb_20, emb_47, emb_49, emb_55"
Session Duration Mean,0.9129815,22,"emb_0, emb_15, emb_16, emb_17, emb_19, emb_2, emb_23, emb_26, emb_27, emb_28, emb_3, emb_32, emb_34, emb_35, emb_39, emb_41, emb_42, emb_43, emb_45, emb_57, emb_62, emb_8"
Feedback Char Len Mean,0.59523034,3,"emb_33, emb_4, emb_6"
Msg Word Len Mean,0.19042102,16,"emb_11, emb_12, emb_13, emb_18, emb_21, emb_36, emb_37, emb_38, emb_40, emb_44, emb_5, emb_50, emb_51, emb_53, emb_54, emb_56"
Account Age Days,0.13328604,8,"emb_10, emb_14, emb_22, emb_29, emb_30, emb_31, emb_59, emb_7"
Feedback Count,0.012917936,1,emb_58
Message Count,0.0,4,"emb_24, emb_61, emb_63, emb_9"
Session Count,0.0,1,emb_46
